{
  "id": "ou-posat-cu-avocado",
  "slug": "ou-posat-cu-avocado",
  "title": "Ou posat cu avocado si somon",
  "description": "Intr-o cratita mica se pune apa la fiert. Cand apa incepe sa fiarba se scade focul la nivel mic.",
  "category": "Mic dejun",
  "ingredients": [
    "Paine (2 felii)",
    "Ou (2 buc)",
    "Avocado (1 buc.)",
    "Ceapa verde (1 buc.)",
    "Castravete Fabio (½ buc.)",
    "Marar (2 lingurite)",
    "Ulei*",
    "Frunze patrunjel*",
    "Unt tartinabil*",
    "Lamaie*",
    "Sare*",
    "Piper*",
    "*dupa gust"
  ],
  "steps": [
    "Intr-o cratita mica se pune apa la fiert. Cand apa incepe sa fiarba se scade focul la nivel mic.",
    "Se inveleste interiorul unei cani cu folie alimentara si se unge cu putin ulei, se adauga un ou si se inchide bine. Se adauga saculetul format cu ou in apa fierbinte si se fierbe la foc mic 6 minute.",
    "Se taie somonul, castravetele si ceapa bucatele mici iar mararul si patrunjelul se toaca marunt.",
    "Avocado se taie pe jumatate si pulpa se piseaza impreuna cu sare si zeama de lamaie. Dupa care se amesteca impreuna cu ingredientele tocate mai devreme.",
    "Feliile de paine se prajesc pana devin usor crocante si se ung cu unt tartinabil, apoi cu amestecul de avocado rezultat mai sus.",
    "Se serveste oul posat impreuna cu feliile de paine."
  ],
  "beforeStart": [
    "Pregătește cratița cu apă și cana cu folie alimentară înainte să începi.",
    "Unge folia cu puțin ulei ca oul să se desprindă mai ușor.",
    "Taie somonul, castravetele și ceapa înainte de asamblare.",
    "Pisează avocado cu lămâie și sare aproape de servire.",
    "Pregătește pâinea pentru prăjire înainte să scoți oul din apă."
  ],
  "tags": {
    "taste": [
      "Fresh",
      "Cremos",
      "Sățios"
    ],
    "complexity": [
      "Complexitate medie",
      "Necesită atenție"
    ],
    "time": [
      "Sub 30 minute"
    ],
    "context": [
      "Mic dejun",
      "Pentru weekend"
    ],
    "diet": [
      "Cu carne"
    ],
    "equipment": [
      "La oală"
    ],
    "technique": [
      "Fierbere"
    ]
  },
  "equipment": [
    "La oală"
  ],
  "prepTimeMinutes": null,
  "cookTimeMinutes": null,
  "totalTimeMinutes": null,
  "servings": null,
  "image": null,
  "sourceUrl": "https://artagatitului.godaddysites.com/ou-posat-cu-avocado",
  "createdAt": null,
  "updatedAt": null,
  "status": "published",
  "closing": "Poftă bună!",
  "keywords": [
    "ou",
    "posat",
    "cu",
    "avocado",
    "si",
    "somon",
    "mic",
    "dejun",
    "paine",
    "2",
    "felii",
    "buc",
    "1",
    "ceapa",
    "verde",
    "castravete",
    "fabio",
    "marar",
    "lingurite",
    "ulei",
    "frunze",
    "patrunjel",
    "unt",
    "tartinabil",
    "lamaie",
    "sare",
    "piper",
    "dupa",
    "gust",
    "fresh",
    "cremos",
    "satios",
    "complexitate",
    "medie",
    "necesita",
    "atentie",
    "sub",
    "30",
    "minute",
    "pentru",
    "weekend",
    "carne",
    "la",
    "oala",
    "fierbere"
  ]
}
