{
  "id": "cartofi-prajiti-cu-sos",
  "slug": "cartofi-prajiti-cu-sos",
  "title": "Cartofi prajiti cu sos de iaurt si menta",
  "description": "Se pune pe foc o oala cu apa si sare. Cartofii se curata si se taie sub forma de pai gros iar cand apa fierbe, se pun la fiert 2-3 minute.",
  "category": "Fel secundar",
  "ingredients": [
    "Cartofi - 6/7 buc.",
    "Sare/Condimente de cartofi (optional)",
    "Oua - 2 buc.",
    "Ulei",
    "Iaurt - 400 g",
    "Smantana - 2/3 lingurite",
    "Usturoi - 2 catei",
    "Menta - 10/15 frunze",
    "Lamaie - 1 buc.",
    "Ulei masline - 2 lingurite",
    "Marar - 1 lingurita",
    "Sare",
    "Piper"
  ],
  "steps": [
    "Cartofii si ouale:",
    "Se pune pe foc o oala cu apa si sare. Cartofii se curata si se taie sub forma de pai gros iar cand apa fierbe, se pun la fiert 2-3 minute.",
    "Se scurge apa fierbinte si se lasa cartofii la racit 5-10 minute. Dupa ce s-au racit, cartofii se pun la prajit in uleiul incins pana se fac aurii.",
    "Dupa prajire se condimenteaza cu sare/codimente pentru cartofi (optional) dupa gust.",
    "Oul se prajeste imediat dupa cartofi in uleiul fierbinte.",
    "Sosul:",
    "Se curata usturoiul si se zdrobeste, dupa care se freaca cu sare si ulei de masline in mojar/bol.",
    "Se razuieste putina coaja de lamaie marunt si se toaca frunzele de menta tocate, zeama de lamaie, piperul si mararul.",
    "Se lasa la frigider 5-10 minute."
  ],
  "beforeStart": [
    "Curăță și taie cartofii înainte să încălzești apa sau uleiul.",
    "Pregătește ingredientele pentru sos într-un bol separat.",
    "Lasă cartofii să se răcească după opărire, ca să se prăjească mai bine.",
    "Pregătește o farfurie cu șervețel pentru cartofii scoși din ulei.",
    "Nu aglomera tigaia când prăjești cartofii."
  ],
  "tags": {
    "taste": [
      "Crocant",
      "Cremos",
      "Acrișor",
      "Fresh",
      "Sățios"
    ],
    "complexity": [
      "Complexitate medie",
      "Necesită atenție"
    ],
    "context": [
      "Gustare",
      "Prânz",
      "Pentru weekend"
    ],
    "diet": [
      "Fără carne",
      "Vegetarian"
    ],
    "equipment": [
      "La tigaie",
      "La oală"
    ],
    "technique": [
      "Fierbere",
      "Prăjire",
      "La tigaie"
    ]
  },
  "equipment": [
    "La tigaie",
    "La oală"
  ],
  "prepTimeMinutes": null,
  "cookTimeMinutes": null,
  "totalTimeMinutes": null,
  "servings": null,
  "image": null,
  "sourceUrl": "https://artagatitului.godaddysites.com/cartofi-prajiti-cu-sos",
  "createdAt": null,
  "updatedAt": null,
  "status": "published",
  "closing": "Poftă bună!",
  "keywords": [
    "cartofi",
    "prajiti",
    "cu",
    "sos",
    "de",
    "iaurt",
    "si",
    "menta",
    "fel",
    "secundar",
    "6-7",
    "buc",
    "sare-condimente",
    "optional",
    "oua",
    "2",
    "ulei",
    "400",
    "g",
    "smantana",
    "2-3",
    "lingurite",
    "usturoi",
    "catei",
    "10-15",
    "frunze",
    "lamaie",
    "1",
    "masline",
    "marar",
    "lingurita",
    "sare",
    "piper",
    "crocant",
    "cremos",
    "acrisor",
    "fresh",
    "satios",
    "complexitate",
    "medie",
    "necesita",
    "atentie",
    "gustare",
    "pranz",
    "pentru",
    "weekend",
    "fara",
    "carne",
    "vegetarian",
    "la",
    "tigaie",
    "oala",
    "fierbere",
    "prajire"
  ]
}
