{
  "id": "pui-dulce-acrisor-cu-orez",
  "slug": "pui-dulce-acrisor-cu-orez",
  "title": "Pui dulce-acrisor cu orez",
  "description": "Se taie pieptul de pui in bucati medii (4-5 cm). Se condimenteaza, dupa gust, cu sare, piper si usturoi praf. Puiul condimentat se da prin faina asi apoi prin ou.",
  "category": "Fel secundar",
  "ingredients": [
    "Piept de pui - 2 buc.",
    "Faina - aprox. 100g",
    "Oua - 2 buc.",
    "Ulei",
    "Sare*",
    "Piper*",
    "Usturoi praf*",
    "Orez - 4 maini",
    "Apa",
    "Ketchup dulce - minim 100g",
    "Zahar - 2 linguri",
    "Otet de mere (orice otet dulce)*",
    "Sos Soia*",
    "Foaie de copt - 1 buc.",
    "*dupa gust"
  ],
  "steps": [
    "Pregatire:",
    "Se taie pieptul de pui in bucati medii (4-5 cm). Se condimenteaza, dupa gust, cu sare, piper si usturoi praf. Puiul condimentat se da prin faina asi apoi prin ou.",
    "Se pregateste sosul: Se amesteca bine ketchup-ul impreuna cu zaharul pana se topeste, se adauga otetul si sosul de soia, totul dupa gus (se poate ajusta in orice moment).",
    "Intr-o tava se intinde foaia de copt.",
    "Se preincalzeste cuptorul la 180°C (cuptor electric cu ventilator)/200°C (cuptor electric fara ventilator).",
    "Gatire:",
    "Intr-o tigaie se pregateste baia de ulei pentru pui.",
    "Dupa ce s-a incins, se adauga puiul si se prajeste pana devine auriu.",
    "Se scoate puiul intr-un bol si peste el se adauga sosul. Se amesteca bine dupa care se transfera in tava de copt pregatita anterior si se baga la cuptor timp de aproximativ 20 min (pana sosul de pe ele s-a redus si a devenit lipicios).",
    "Pana se coace puiul, se fierbe orezul impreuna cu putina sare, dupa gust.",
    "Se serveste cald."
  ],
  "beforeStart": [
    "Taie puiul și pregătește făina și oul pentru acoperire.",
    "Amestecă sosul dulce-acrișor înainte să pornești gătirea.",
    "Întinde foaia de copt în tavă.",
    "Preîncălzește cuptorul la temperatura indicată în rețetă.",
    "Pregătește orezul și apa pentru fierbere."
  ],
  "tags": {
    "taste": [
      "Dulce",
      "Acrișor",
      "Sățios"
    ],
    "complexity": [
      "Complexitate medie",
      "Necesită atenție"
    ],
    "context": [
      "Prânz",
      "Cină",
      "Pentru familie"
    ],
    "diet": [
      "Cu carne"
    ],
    "equipment": [
      "Necesită cuptor",
      "Necesită tavă",
      "La oală"
    ],
    "technique": [
      "Coacere",
      "Fierbere",
      "La cuptor"
    ]
  },
  "equipment": [
    "Necesită cuptor",
    "Necesită tavă",
    "La oală"
  ],
  "prepTimeMinutes": null,
  "cookTimeMinutes": null,
  "totalTimeMinutes": null,
  "servings": null,
  "image": null,
  "sourceUrl": "https://artagatitului.godaddysites.com/pui-dulce-acrisor-cu-orez",
  "createdAt": null,
  "updatedAt": null,
  "status": "published",
  "closing": "Poftă bună!",
  "keywords": [
    "pui",
    "dulce-acrisor",
    "cu",
    "orez",
    "fel",
    "secundar",
    "piept",
    "de",
    "2",
    "buc",
    "faina",
    "aprox",
    "100g",
    "oua",
    "ulei",
    "sare",
    "piper",
    "usturoi",
    "praf",
    "4",
    "maini",
    "apa",
    "ketchup",
    "dulce",
    "minim",
    "zahar",
    "linguri",
    "otet",
    "mere",
    "orice",
    "sos",
    "soia",
    "foaie",
    "copt",
    "1",
    "dupa",
    "gust",
    "acrisor",
    "satios",
    "complexitate",
    "medie",
    "necesita",
    "atentie",
    "pranz",
    "cina",
    "pentru",
    "familie",
    "carne",
    "cuptor",
    "tava",
    "la",
    "oala",
    "coacere",
    "fierbere"
  ]
}
