{
  "id": "steak-de-vita",
  "slug": "steak-de-vita",
  "title": "Steak de vita",
  "description": "Scoate-ti carnea de la frigider si lasati-o la temperatura camerei 30 min.",
  "category": "Fel secundar",
  "ingredients": [
    "Ustensile:",
    "Tigaie tip grill non-stick",
    "Cleste (nu furculita, ca sa nu perforezi carnea)",
    "Termometru de carne (optional)",
    "Farfurie/platou/tocator de lemn pentru odihnirea carnii dupa prajire",
    "Folie de aluminiu",
    "Pentru Carne:",
    "Vrabioara manzat - 2 buc. (aprox 350 g)",
    "Sare grunjoasa",
    "Piper negru proaspat rasnit",
    "Ulei floarea soarelui",
    "Mustar Dijon - 3 lingurite",
    "Ulei masline extravirgin - 3 lingurite",
    "Usturoi pudra - 1 lingurita",
    "Boia dulce - 1 lingurita",
    "Cimbru uscat - 1/2 lingurita",
    "Optional carne:",
    "Unt - 1 lingura",
    "Usturoi - 1 catel",
    "Rozmarin - 1 crenguta",
    "Side:",
    "Piure cartofi:",
    "Fulgi cartofi/cartofi",
    "Unt",
    "Lapte",
    "Sare",
    "Salata verde:",
    "Salata iceberg - 1/2 buc.",
    "Rosii chery - aprox. 10 buc.",
    "Ceapa rosie - 1/4 buc.",
    "Castrevete - 5 buc. (cornison)"
  ],
  "steps": [
    "CARNE",
    "Quick rub/Marinare:",
    "Scoate-ti carnea de la frigider si lasati-o la temperatura camerei 30 min.",
    "Intr-un bol mic amestecati mustarul Dijon, uleiul de masline, pudra de usturoi, boiaua dulce si cimbrul uscat.",
    "Se unge fiecare bucata de carne cu sosul format si se lasa la frigider pentru marinare mai lunga (inainte de prajire se lasa carnea la temperatura camerei timp de 30 min) sau, pentru servire rapida, la temperatura camerei timp de 20-30 min.",
    "Incalzire tigaie:",
    "Se pune tigaia grill pe foc si se incalzeste pe for mediu-mare spre mare timp de aprox 5 min (fara sa fumege). NU SE PUNE ULEI IN TIGAIE! SE VA UNGE NUMAI CARNEA CU ULEI!",
    "Uscarea si condimentarea finala:",
    "Se sterge usor surprusul de marinada de pe carne cu un servetel.",
    "Se tamponeaza usor cu ulei folosind pensula si se condimenteaza cu sare si piper ambele fete ale carnii.",
    "Prajirea:",
    "Vezi calculatorul de mai jos!",
    "Pentru o crusta perfecta apasa carnea cu clestele timp de 10 sec. dupa ce o pui in tigaie pentru a avea un contact bun cu tigaia.",
    "PIURE DE CARTOFI",
    "Se infuzeaza laptele cu crenguta de rozmarin timp de 10-20 min.",
    "Se fierbe apa impreuna cu cartofii (pentru fulgi se fierbe prima data apa si apoi se adauga fulgii).",
    "Se piseaza carfoii si se adauga laptele si untul."
  ],
  "beforeStart": [
    "Scoate carnea din frigider cu 20-30 minute înainte.",
    "Tamponează steak-ul cu șervețele, ca suprafața să fie uscată.",
    "Pregătește tigaia aleasă, cleștele și un loc pentru odihnirea cărnii.",
    "Citește pașii și setează calculatorul înainte să pui carnea în tigaie.",
    "Pregătește un timer sau folosește timerul din pagină."
  ],
  "tags": {
    "taste": [
      "Sățios",
      "Aromat"
    ],
    "complexity": [
      "Necesită atenție"
    ],
    "context": [
      "Cină",
      "Pentru weekend"
    ],
    "diet": [
      "Cu carne"
    ],
    "equipment": [
      "La tigaie",
      "Necesită termometru"
    ],
    "technique": [
      "La tigaie",
      "Marinare"
    ]
  },
  "equipment": [
    "La tigaie",
    "Necesită termometru"
  ],
  "prepTimeMinutes": null,
  "cookTimeMinutes": null,
  "totalTimeMinutes": null,
  "servings": null,
  "image": null,
  "sourceUrl": "https://artagatitului.godaddysites.com/steak-de-vita",
  "createdAt": null,
  "updatedAt": null,
  "status": "published",
  "closing": "Poftă bună!",
  "extras": [
    {
      "type": "steak-calculator",
      "title": "Calculator gatire steak vita"
    }
  ],
  "keywords": [
    "steak",
    "de",
    "vita",
    "fel",
    "secundar",
    "ustensile",
    "tigaie",
    "tip",
    "grill",
    "non-stick",
    "cleste",
    "nu",
    "furculita",
    "ca",
    "sa",
    "perforezi",
    "carnea",
    "termometru",
    "carne",
    "optional",
    "farfurie-platou-tocator",
    "lemn",
    "pentru",
    "odihnirea",
    "carnii",
    "dupa",
    "prajire",
    "folie",
    "aluminiu",
    "vrabioara",
    "manzat",
    "2",
    "buc",
    "aprox",
    "350",
    "g",
    "sare",
    "grunjoasa",
    "piper",
    "negru",
    "proaspat",
    "rasnit",
    "ulei",
    "floarea",
    "soarelui",
    "mustar",
    "dijon",
    "3",
    "lingurite",
    "masline",
    "extravirgin",
    "usturoi",
    "pudra",
    "1",
    "lingurita",
    "boia",
    "dulce",
    "cimbru",
    "uscat",
    "1-2",
    "unt",
    "lingura",
    "catel",
    "rozmarin",
    "crenguta",
    "side",
    "piure",
    "cartofi",
    "fulgi",
    "cartofi-cartofi",
    "lapte",
    "salata",
    "verde",
    "iceberg",
    "rosii",
    "chery",
    "10",
    "ceapa",
    "rosie",
    "1-4",
    "castrevete",
    "5",
    "cornison",
    "satios",
    "aromat",
    "necesita",
    "atentie",
    "cina",
    "weekend",
    "cu",
    "la",
    "marinare"
  ]
}
