{
  "id": "ciorba-de-fasole",
  "slug": "ciorba-de-fasole",
  "title": "Ciorba De Fasole Cu Afumatura",
  "description": "Se pune fasolea la umflat cu o zi inainte dupa care se arunca apa.",
  "category": "Fel principal",
  "ingredients": [
    "Fasole - 300g",
    "Apa",
    "Ceapa - 3 buc.",
    "Morcovi - 1 buc.",
    "Ulei",
    "Ardei rosu gras - 1/4 buc.",
    "Aredi galben gras - 1/4 buc.",
    "Sare",
    "Leustean",
    "Pasta de tomate - 2 linguri",
    "Afumatura"
  ],
  "steps": [
    "Pregatire:",
    "Se pune fasolea la umflat cu o zi inainte dupa care se arunca apa.",
    "Se fierbe fasolea pana la clocot si se schimba apa de 2 ori.",
    "Se toaca ceapa marunt.",
    "Se toaca ardeiul marunt.",
    "Se rade morcovul.",
    "Gatire:",
    "Se fierbe afumatura pana devine moale.",
    "Se fierbe fasolea pana devine moale si usor de strivit in apa de la afumatura fiarta (se mai adauga apa dupa nevoie).",
    "Se calesc legumele impreuna si periodic se adauga o lingura de apa sa se inmoaie. Dupa ce seaca apa se adauga pasta de tomate si se caleste timp de 2-3 minute. In amestec se adauga un polonic din supa de fasole si se fierbe timp de aproximativ 5 minute.",
    "Amestecul se adauga in oala cu ciorba de fasole si se fierbe din nou.",
    "La final se adauga sare dupa gust.",
    "Dupa ce s-a oprit focul, se adauga leustenul.",
    "Se serveste cald impreuna paine proaspata."
  ],
  "beforeStart": [
    "Pune fasolea la înmuiat cu o zi înainte și aruncă apa înainte de fierbere.",
    "Pregătește o oală încăpătoare pentru schimbarea apei la primele clocote.",
    "Curăță și taie ceapa, ardeiul și morcovul înainte să pornești focul.",
    "Pregătește afumătura, pasta de tomate și leușteanul pentru momentul potrivit."
  ],
  "tags": {
    "taste": [
      "Sărat",
      "Sățios",
      "Aromat",
      "Rustic"
    ],
    "complexity": [
      "Complexitate medie",
      "Necesită atenție"
    ],
    "time": [
      "Necesită timp de așteptare",
      "Bună pentru pregătit din timp"
    ],
    "context": [
      "Prânz",
      "Cină",
      "Pentru familie",
      "Comfort food"
    ],
    "diet": [
      "Cu carne"
    ],
    "equipment": [
      "La oală"
    ],
    "technique": [
      "Fierbere",
      "Sotare"
    ]
  },
  "equipment": [
    "La oală"
  ],
  "prepTimeMinutes": null,
  "cookTimeMinutes": null,
  "totalTimeMinutes": null,
  "servings": null,
  "image": null,
  "sourceUrl": "https://artagatitului.godaddysites.com/ciorba-de-fasole",
  "createdAt": null,
  "updatedAt": null,
  "status": "published",
  "closing": "Poftă bună!",
  "keywords": [
    "ciorba",
    "de",
    "fasole",
    "cu",
    "afumatura",
    "fel",
    "principal",
    "300g",
    "apa",
    "ceapa",
    "3",
    "buc",
    "morcovi",
    "1",
    "ulei",
    "ardei",
    "rosu",
    "gras",
    "1-4",
    "aredi",
    "galben",
    "sare",
    "leustean",
    "pasta",
    "tomate",
    "2",
    "linguri",
    "sarat",
    "satios",
    "aromat",
    "rustic",
    "complexitate",
    "medie",
    "necesita",
    "atentie",
    "timp",
    "asteptare",
    "buna",
    "pentru",
    "pregatit",
    "din",
    "pranz",
    "cina",
    "familie",
    "comfort",
    "food",
    "carne",
    "la",
    "oala",
    "fierbere",
    "sotare"
  ]
}
