{
  "id": "pulpe-de-pui-cu-orzo",
  "slug": "pulpe-de-pui-cu-orzo",
  "title": "Pulpe de pui dezosate cu orzo",
  "description": "Se bat pulpele de pui putin. Se condimenteaza cu boia dulce, sare, piper, usturoi praf, curry si cimbru.",
  "category": "Fel secundar",
  "ingredients": [
    "Pulpe de pui dezosate - 4 buc.",
    "Boia dulce*",
    "Sare*",
    "Piper*",
    "Usturoi praf*",
    "Curry*",
    "Cimbru*",
    "Unt",
    "Ulei dasline",
    "Orzo - 400g",
    "Ciuperci - 250g",
    "Catei de usturoi - 6 buc.",
    "Cuburi Maggi - 2 buc.",
    "Apa - 1,2 litri",
    "Patrunjel - 1 legatura",
    "Parmezan - 50g",
    "Unt topit",
    "Ceapa verde - 2 buc.",
    "Zeama lamaie - 2 lamai",
    "*dupa gust"
  ],
  "steps": [
    "Pregatire:",
    "Se bat pulpele de pui putin. Se condimenteaza cu boia dulce, sare, piper, usturoi praf, curry si cimbru.",
    "Se taie ciupercile felii.",
    "Se toaca patrunjelul.",
    "Se razuieste parmezanul.",
    "Gatire:",
    "Se pregateste sosul: Se topeste untul. Se taie ceapa verde marunt. Se storc doua lamai si se amesteca toate impreuna cu sarea, dupa gust.",
    "Se fierbe apa impreuna cu cele doua cuburi de magi (sau se gateste supa si se strecoara).",
    "Intr-o tigaie se adauga ulei de masline si unt si se prajesc pulpele de pui pana se coloreaza auriu. Se scot pulpele de pui pe o farfurie.",
    "In aceeasi tigaie se pun ciupercile la calit cu putin unt. Spre final se zdropseste usturoiul, cu presa de usturoi peste ciuperci si se mai caleste 1-2 min. Peste continutul tigaii, se adauga supa de pui si orzo. Se lasa la fiert mestecand frecvent pana scade. Se adauga parmezanul razuit si patrunjelul taiat marunt. Se amesteca bine impreuna cu un cubulet de unt si puiul.",
    "Se serveste cald impreuna cu sosul."
  ],
  "beforeStart": [
    "Condimentează pulpele înainte să încălzești tigaia.",
    "Taie ciupercile, toacă pătrunjelul și rade parmezanul dinainte.",
    "Pregătește orzo-ul și lichidul necesar pentru gătire.",
    "Ține untul, uleiul și usturoiul la îndemână pentru începutul gătirii."
  ],
  "tags": {
    "taste": [
      "Cremos",
      "Sățios",
      "Aromat"
    ],
    "complexity": [
      "Complexitate medie"
    ],
    "context": [
      "Prânz",
      "Cină",
      "Pentru familie"
    ],
    "diet": [
      "Cu carne"
    ],
    "equipment": [
      "La tigaie"
    ],
    "technique": [
      "Sotare",
      "La tigaie"
    ]
  },
  "equipment": [
    "La tigaie"
  ],
  "prepTimeMinutes": null,
  "cookTimeMinutes": null,
  "totalTimeMinutes": null,
  "servings": null,
  "image": null,
  "sourceUrl": "https://artagatitului.godaddysites.com/pulpe-de-pui-cu-orzo",
  "createdAt": null,
  "updatedAt": null,
  "status": "published",
  "closing": "Poftă bună!",
  "keywords": [
    "pulpe",
    "de",
    "pui",
    "dezosate",
    "cu",
    "orzo",
    "fel",
    "secundar",
    "4",
    "buc",
    "boia",
    "dulce",
    "sare",
    "piper",
    "usturoi",
    "praf",
    "curry",
    "cimbru",
    "unt",
    "ulei",
    "dasline",
    "400g",
    "ciuperci",
    "250g",
    "catei",
    "6",
    "cuburi",
    "maggi",
    "2",
    "apa",
    "1-2",
    "litri",
    "patrunjel",
    "1",
    "legatura",
    "parmezan",
    "50g",
    "topit",
    "ceapa",
    "verde",
    "zeama",
    "lamaie",
    "lamai",
    "dupa",
    "gust",
    "cremos",
    "satios",
    "aromat",
    "complexitate",
    "medie",
    "pranz",
    "cina",
    "pentru",
    "familie",
    "carne",
    "la",
    "tigaie",
    "sotare"
  ]
}
