{
  "id": "conopida-cu-orez-1",
  "slug": "conopida-cu-orez-1",
  "title": "Conopida cu orez si sos rosu",
  "description": "Se spala si se taie bucati medii. Se condimenteaza cu sare, piper, boia si curry. Intr-o tigaie adanca se pune uleiul la incalzit.",
  "category": "Fel secundar",
  "ingredients": [
    "Conopida - 1 buc.",
    "Boia - 1 lingura",
    "Curry - 1 lingura",
    "Oua - 3 buc.",
    "Pesmet - 300 g",
    "Sare",
    "Piper",
    "Ulei",
    "Ceapa - 1 buc. mare",
    "Conserva rosii intregi - 1 buc.",
    "Unt - 1 lingura",
    "Usturoi - 2 catei",
    "Curcuma - 1 lingurita",
    "Sos picant - 1 lingurita",
    "Ghimbir - 1 lingurita",
    "Coriandru - 1 lingurita",
    "Boia - 1 lingurita",
    "Zahar - 1 lingurita",
    "Iaurt - 1 lingurita",
    "Patrunjel"
  ],
  "steps": [
    "Conopida:",
    "Se spala si se taie bucati medii. Se condimenteaza cu sare, piper, boia si curry. Intr-o tigaie adanca se pune uleiul la incalzit.",
    "Intr-un bol se bat 3 oua si se condimenteaza cu sare si piper. Intr-o farfurie se pune pesmetul. Cand uleiul este incins, se trec bucatile de conopida prin ou si prin pesmet apoi se pun la prajit pana se fac aurii.",
    "Sos:",
    "Se curata si se taie marunt ceapa si usturoiul. Acestea se calesc in unt pana cand sunt aurii. In aceeasi tigaie se adauga conserva de rosii, curcuma, ghimbir, coriandru, boia si zahar. Se lasa la fiert si se amesteca pana totul este omogen. Dupa ce s-a omogenizat, se lasa la racit apoi se transfera totul intr-un blender de mana unde se mai adauga iaurt si sos picant. Dupa ce a fost belduit, se adauga intr-un bol si se decoreaza cu frunze de patrunjel."
  ],
  "beforeStart": [
    "Spală conopida și taie-o în bucăți medii înainte să încălzești uleiul.",
    "Pregătește farfuria cu pesmet și bolul cu ou bătut.",
    "Curăță și toacă ceapa și usturoiul pentru sos înainte de gătire.",
    "Pregătește blenderul de mână pentru omogenizarea sosului.",
    "Ține la îndemână o farfurie pentru bucățile de conopidă prăjite."
  ],
  "tags": {
    "taste": [
      "Crocant",
      "Condimentat",
      "Cremos",
      "Sățios"
    ],
    "complexity": [
      "Complexitate medie",
      "Necesită atenție"
    ],
    "context": [
      "Prânz",
      "Cină",
      "Pentru weekend"
    ],
    "diet": [
      "Fără carne",
      "Vegetarian"
    ],
    "equipment": [
      "La tigaie",
      "Necesită blender"
    ],
    "technique": [
      "Prăjire",
      "Sotare",
      "La tigaie"
    ]
  },
  "equipment": [
    "La tigaie",
    "Necesită blender"
  ],
  "prepTimeMinutes": null,
  "cookTimeMinutes": null,
  "totalTimeMinutes": null,
  "servings": null,
  "image": null,
  "sourceUrl": "https://artagatitului.godaddysites.com/conopida-cu-orez-1",
  "createdAt": null,
  "updatedAt": null,
  "status": "published",
  "closing": "Poftă bună!",
  "keywords": [
    "conopida",
    "cu",
    "orez",
    "si",
    "sos",
    "rosu",
    "fel",
    "secundar",
    "1",
    "buc",
    "boia",
    "lingura",
    "curry",
    "oua",
    "3",
    "pesmet",
    "300",
    "g",
    "sare",
    "piper",
    "ulei",
    "ceapa",
    "mare",
    "conserva",
    "rosii",
    "intregi",
    "unt",
    "usturoi",
    "2",
    "catei",
    "curcuma",
    "lingurita",
    "picant",
    "ghimbir",
    "coriandru",
    "zahar",
    "iaurt",
    "patrunjel",
    "crocant",
    "condimentat",
    "cremos",
    "satios",
    "complexitate",
    "medie",
    "necesita",
    "atentie",
    "pranz",
    "cina",
    "pentru",
    "weekend",
    "fara",
    "carne",
    "vegetarian",
    "la",
    "tigaie",
    "blender",
    "prajire",
    "sotare"
  ]
}
